{
 "spec": "skeleton-roles/1",
 "id": "quadruped_bear_profile",
 "view": {
  "yaw_deg": 0,
  "facing": "right"
 },
 "parts": [
  {
   "id": "trunk",
   "kind": "trunk"
  },
  {
   "id": "head",
   "kind": "head"
  },
  {
   "id": "leg_hind_L",
   "kind": "leg",
   "side": "L",
   "girdle": "pelvic",
   "layer": "front",
   "visible": true
  },
  {
   "id": "leg_hind_R",
   "kind": "leg",
   "side": "R",
   "girdle": "pelvic",
   "layer": "behind",
   "visible": false
  },
  {
   "id": "leg_fore_L",
   "kind": "leg",
   "side": "L",
   "girdle": "pectoral",
   "layer": "front",
   "visible": true
  },
  {
   "id": "leg_fore_R",
   "kind": "leg",
   "side": "R",
   "girdle": "pectoral",
   "layer": "behind",
   "visible": false
  }
 ],
 "joints": [
  {
   "id": "trunk1",
   "parent": null,
   "pos": [
    0,
    0.4
   ],
   "part": "trunk"
  },
  {
   "id": "trunk2",
   "parent": "trunk1",
   "pos": [
    0.25,
    0.42
   ],
   "part": "trunk"
  },
  {
   "id": "trunk3",
   "parent": "trunk2",
   "pos": [
    0.5,
    0.44
   ],
   "part": "trunk"
  },
  {
   "id": "head1",
   "parent": "trunk3",
   "pos": [
    0.62,
    0.5
   ],
   "part": "head"
  },
  {
   "id": "head2",
   "parent": "head1",
   "pos": [
    0.74,
    0.5
   ],
   "part": "head"
  },
  {
   "id": "leg_hind_L1",
   "parent": "trunk1",
   "pos": [
    0.0,
    0.25
   ],
   "part": "leg_hind_L"
  },
  {
   "id": "leg_hind_L2",
   "parent": "leg_hind_L1",
   "pos": [
    0.02,
    0.12
   ],
   "part": "leg_hind_L"
  },
  {
   "id": "leg_hind_L3",
   "parent": "leg_hind_L2",
   "pos": [
    0.05,
    0.0
   ],
   "part": "leg_hind_L"
  },
  {
   "id": "leg_hind_R1",
   "parent": "trunk1",
   "pos": [
    0.0,
    0.25
   ],
   "part": "leg_hind_R"
  },
  {
   "id": "leg_hind_R2",
   "parent": "leg_hind_R1",
   "pos": [
    0.02,
    0.12
   ],
   "part": "leg_hind_R"
  },
  {
   "id": "leg_hind_R3",
   "parent": "leg_hind_R2",
   "pos": [
    0.05,
    0.0
   ],
   "part": "leg_hind_R"
  },
  {
   "id": "leg_fore_L1",
   "parent": "trunk3",
   "pos": [
    0.5,
    0.25
   ],
   "part": "leg_fore_L"
  },
  {
   "id": "leg_fore_L2",
   "parent": "leg_fore_L1",
   "pos": [
    0.52,
    0.12
   ],
   "part": "leg_fore_L"
  },
  {
   "id": "leg_fore_L3",
   "parent": "leg_fore_L2",
   "pos": [
    0.55,
    0.0
   ],
   "part": "leg_fore_L"
  },
  {
   "id": "leg_fore_R1",
   "parent": "trunk3",
   "pos": [
    0.5,
    0.25
   ],
   "part": "leg_fore_R"
  },
  {
   "id": "leg_fore_R2",
   "parent": "leg_fore_R1",
   "pos": [
    0.52,
    0.12
   ],
   "part": "leg_fore_R"
  },
  {
   "id": "leg_fore_R3",
   "parent": "leg_fore_R2",
   "pos": [
    0.55,
    0.0
   ],
   "part": "leg_fore_R"
  }
 ],
 "declared_class": "quadruped"
}
